{
  "created_at": "2026-10-20T08:00:00Z",
  "deadline_at": "2026-10-20T08:20:00Z",
  "job_id": "00000000-0000-0000-0000-000000000333",
  "message": "Analysis complete.",
  "progress": 100,
  "report_reference": {
    "case_id": "00000000-0000-0000-0000-000000000111",
    "payload_checksum": "sha256:bbbbbbbbbbbbbbbbbbbbbbbbbbbbbbbbbbbbbbbbbbbbbbbbbbbbbbbbbbbbbbbb",
    "report_id": "00000000-0000-0000-0000-000000000333",
    "report_type": "prospect",
    "schema_version": "2.2.2"
  },
  "revision": 4,
  "run_generation": 1,
  "schema_version": "v22_capability_task_status_v1",
  "stage": "completed",
  "status": "succeeded",
  "updated_at": "2026-10-20T08:03:00Z"
}
